{
  "version": "1.0.0-draft",
  "status": "draft",
  "product": {
    "type": "Product",
    "identifier": "https://w3id.org/battinfo/cell-type/8c1h-8pk6-8034-vav6",
    "short_id": "8c1h8p",
    "name": "CALB_CA100",
    "description": "Draft cell-type datasheet derived from CellInfo source record cellinfo:CALB_CA100.",
    "brand": "CALB",
    "manufacturer": "CALB",
    "model": "CALB_CA100",
    "chemistry": "Li-ion",
    "positive_electrode_basis": "LFP",
    "negative_electrode_basis": "unknown",
    "format": "prismatic",
    "category": "prismatic battery cell",
    "application": "battery cell"
  },
  "specs": {
    "cycle_life": {
      "value": 2000.0,
      "unit": "count"
    },
    "charging_voltage": {
      "value": 3.65,
      "unit": "V"
    },
    "discharging_cutoff_voltage": {
      "value": 2.5,
      "unit": "V"
    },
    "discharging_current": {
      "value": 30.0,
      "unit": "A"
    },
    "max_discharging_current": {
      "value": 200.0,
      "unit": "A"
    },
    "continuous_discharging_current": {
      "value": 200.0,
      "unit": "A"
    },
    "charging_current": {
      "value": 30.0,
      "unit": "A"
    },
    "max_charging_current": {
      "value": 100.0,
      "unit": "A"
    },
    "height": {
      "value": 0.067,
      "unit": "m"
    },
    "width": {
      "value": 0.213,
      "unit": "m"
    },
    "length": {
      "value": 0.142,
      "unit": "m"
    },
    "nominal_capacity": {
      "value": 100.0,
      "unit": "Ah"
    },
    "nominal_voltage": {
      "value": 3.2,
      "unit": "V"
    },
    "mass": {
      "value": 3.4,
      "unit": "kg"
    }
  },
  "lineage": {
    "source_record": "src/battinfo/data/examples/cells-clean/CALB_CA100.json",
    "source_type": "curated",
    "source_file": "CALB_CA100.curated.json",
    "source_id": "cellinfo:CALB_CA100",
    "source_url": "https://github.com/TUMFTM/TruckBatteryDesign/raw/main/Step1_cell_selection/inputs/CellDatabase_v6.xlsx",
    "extracted_at": "2026-01-28T07:25:48.614078+00:00"
  },
  "quality": {
    "missing_fields": [],
    "inferred_fields": [
      "cell.format"
    ],
    "warnings": []
  },
  "notes": [
    "Draft v1 datasheet generated from BattINFO canonical cells-clean record.",
    "This is not an original manufacturer PDF datasheet.",
    "Capacity convention: if both typical and rated capacities are available, keep typical in specs.nominal_capacity.value_typical and rated in specs.rated_capacity.value.",
    "Electrode-basis fields can be more specific than chemistry family."
  ],
  "extensions": {
    "x-battinfo-ingest_batch": "cellinfo-top10-diverse-v1"
  },
  "references": [
    {
      "type": "database",
      "title": "CALB_CA100.curated.json",
      "url": "https://github.com/TUMFTM/TruckBatteryDesign/raw/main/Step1_cell_selection/inputs/CellDatabase_v6.xlsx",
      "accessed_at": "2026-01-28T07:25:48.614078+00:00"
    }
  ]
}
